{
    "schemaVersion": "0.1.0",
    "class": "Device",
    "label": "my BIG-IP declaration for declarative onboarding",
    "Common": {
        "class": "Tenant",
        "hostname": "bigip.example.com",
        "myLicense": {
            "class": "License",
            "licenseType": "regKey",
            "regKey": "AAAAA-BBBBB-CCCCC-DDDDD-EEEEEEE"
        },
        "myProvisioning": {
            "class": "Provision",
            "ltm": "nominal"
        },
        "myDns": {
            "class": "DNS",
            "nameServers": [
                "8.8.8.8",
                "2001:4860:4860::8844"
            ],
            "search": [
                "f5.com"
            ]
        },
        "myNtp": {
            "class": "NTP",
            "servers": [
                "0.pool.ntp.org",
                "1.pool.ntp.org"
            ],
            "timezone": "UTC"
        },
        "root": {
            "class": "User",
            "userType": "root",
            "oldPassword": "default",
            "newPassword": "myNewPass1word"
        },
        "admin": {
            "class": "User",
            "userType": "regular",
            "password": "asdfjkl",
            "shell": "bash"
        },
        "anotherUser": {
            "class": "User",
            "userType": "regular",
            "password": "foobar",
            "partitionAccess": {
                "Common": {
                    "role": "guest"
                }
            }
        },
        "myVlan": {
            "class": "VLAN",
            "tag": 1234,
            "mtu": 1500,
            "interfaces": [
                {
                    "name": "1.1",
                    "tagged": true
                }
            ]
        },
        "mySelfIp": {
            "class": "SelfIp",
            "address": "1.2.3.4/24",
            "vlan": "myVlan",
            "allowService": "all",
            "floating": true
        },
        "myRoute": {
            "class": "Route",
            "gw": "10.1.20.1",
            "network": "default",
            "mtu": 0
        }
    }
}